"","id","speaker_id","utterance_order","transcript_id","corpus_id","gloss","num_tokens","stem","part_of_speech","speaker_code","speaker_name","speaker_role","target_child_id","target_child_age","target_child_name","target_child_sex","type","media_end","media_start","media_unit","collection_id","collection_name","num_morphemes","language","corpus_name"
"209",4211907,6556,147,11098,91,"we don't need this",4,"we do need this","pro:sub mod v pro:dem","CLI",NA,"Clinician",6555,140.002874802357,"Sarah","female","declarative",NA,NA,NA,4,"Clinical-MOR",5,"eng","Bliss"
"210",4211928,6556,148,11098,91,"besides I thought you were going to take our people for a ride",13,"besides I think you be go to take our person for a ride","adv pro:sub v pro:per aux part inf v det:poss n prep det:art n","CLI",NA,"Clinician",6555,140.002874802357,"Sarah","female","declarative",NA,NA,NA,4,"Clinical-MOR",17,"eng","Bliss"
"211",4211989,6556,149,11098,91,"you have them all in the bus",7,"you have them all in the bus","pro:per v pro:obj pro:indef prep det:art n","CLI",NA,"Clinician",6555,140.002874802357,"Sarah","female","declarative",NA,NA,NA,4,"Clinical-MOR",7,"eng","Bliss"
"212",4212109,6556,152,11098,91,"oh well I think I'm going to take these people for a ride",13,"oh well I think I go to take these person for a ride","co n pro:sub v pro:sub part inf v pro:dem n prep det:art n","CLI",NA,"Clinician",6555,140.002874802357,"Sarah","female","declarative",NA,NA,NA,4,"Clinical-MOR",16,"eng","Bliss"
"213",4212202,6556,154,11098,91,"no",1,"no","co","CLI",NA,"Clinician",6555,140.002874802357,"Sarah","female","question",NA,NA,NA,4,"Clinical-MOR",1,"eng","Bliss"
"214",4212237,6556,156,11098,91,"where are you going to go",6,"where be you go to go","adv:int aux pro:per part inf v","CLI",NA,"Clinician",6555,140.002874802357,"Sarah","female","question",NA,NA,NA,4,"Clinical-MOR",8,"eng","Bliss"
"215",4212263,6556,157,11098,91,"where are you going to take them",7,"where be you go to take them","adv:int aux pro:per part inf v pro:obj","CLI",NA,"Clinician",6555,140.002874802357,"Sarah","female","question",NA,NA,NA,4,"Clinical-MOR",9,"eng","Bliss"
"216",4212317,6556,159,11098,91,"no",1,"no","co","CLI",NA,"Clinician",6555,140.002874802357,"Sarah","female","declarative",NA,NA,NA,4,"Clinical-MOR",1,"eng","Bliss"
"217",4212331,6556,160,11098,91,"buses don't drive in the house",6,"bus do drive in the house","n mod v prep det:art n","CLI",NA,"Clinician",6555,140.002874802357,"Sarah","female","declarative",NA,NA,NA,4,"Clinical-MOR",8,"eng","Bliss"
"218",4212365,6556,161,11098,91,"where're you going to take them",6,"where you go to take them","adv:int pro:per part inf v pro:obj","CLI",NA,"Clinician",6555,140.002874802357,"Sarah","female","question",NA,NA,NA,4,"Clinical-MOR",8,"eng","Bliss"
"219",4212433,6556,163,11098,91,"where do buses go",4,"where do bus go","adv:int v n v","CLI",NA,"Clinician",6555,140.002874802357,"Sarah","female","question",NA,NA,NA,4,"Clinical-MOR",5,"eng","Bliss"
"220",4212474,6556,165,11098,91,"no",1,"no","co","CLI",NA,"Clinician",6555,140.002874802357,"Sarah","female","declarative",NA,NA,NA,4,"Clinical-MOR",1,"eng","Bliss"
"221",4212485,6556,166,11098,91,"where do they travel",4,"where do they travel","adv:int mod pro:sub v","CLI",NA,"Clinician",6555,140.002874802357,"Sarah","female","question",NA,NA,NA,4,"Clinical-MOR",4,"eng","Bliss"
"222",4212527,6556,168,11098,91,"they can go in a garage",6,"they can go in a garage","pro:sub mod v prep det:art n","CLI",NA,"Clinician",6555,140.002874802357,"Sarah","female","declarative",NA,NA,NA,4,"Clinical-MOR",6,"eng","Bliss"
"223",4212600,6556,170,11098,91,"who",1,"who","pro:rel","CLI",NA,"Clinician",6555,140.002874802357,"Sarah","female","question",NA,NA,NA,4,"Clinical-MOR",1,"eng","Bliss"
"224",4212628,6556,172,11098,91,"no",1,"no","co","CLI",NA,"Clinician",6555,140.002874802357,"Sarah","female","declarative",NA,NA,NA,4,"Clinical-MOR",1,"eng","Bliss"
"225",4212637,6556,173,11098,91,"I'm taking the bus back you're being silly",8,"I take the bus back you be silly","pro:sub part det:art n adv pro:per part adj","CLI",NA,"Clinician",6555,140.002874802357,"Sarah","female","declarative",NA,NA,NA,4,"Clinical-MOR",12,"eng","Bliss"
"226",4212673,6556,174,11098,91,"we don't put buses in the house",7,"we do put bus in the house","pro:sub mod v n prep det:art n","CLI",NA,"Clinician",6555,140.002874802357,"Sarah","female","declarative",NA,NA,NA,4,"Clinical-MOR",10,"eng","Bliss"
"227",4212722,6556,176,11098,91,"where are you going to put them",7,"where be you go to put them","adv:int aux pro:per part inf v pro:obj","CLI",NA,"Clinician",6555,140.002874802357,"Sarah","female","question",NA,NA,NA,4,"Clinical-MOR",10,"eng","Bliss"
"228",4212772,6556,178,11098,91,"they're having company",3,"they have company","pro:sub part n","CLI",NA,"Clinician",6555,140.002874802357,"Sarah","female","question",NA,NA,NA,4,"Clinical-MOR",5,"eng","Bliss"
"229",4212796,6556,179,11098,91,"where are you going to put all your company",9,"where be you go to put all your company","adv:int aux pro:per part inf v qn det:poss n","CLI",NA,"Clinician",6555,140.002874802357,"Sarah","female","question",NA,NA,NA,4,"Clinical-MOR",12,"eng","Bliss"
"230",4212849,6556,181,11098,91,"you're going to put them in the garage",8,"you go to put them in the garage","pro:per part inf v pro:obj prep det:art n","CLI",NA,"Clinician",6555,140.002874802357,"Sarah","female","question",NA,NA,NA,4,"Clinical-MOR",11,"eng","Bliss"
"231",4212885,6556,182,11098,91,"are they going to sleep in there too",8,"be they go to sleep in there too","cop pro:sub part prep n prep pro:exist post","CLI",NA,"Clinician",6555,140.002874802357,"Sarah","female","question",NA,NA,NA,4,"Clinical-MOR",10,"eng","Bliss"
"232",4212918,6556,183,11098,91,"no they're not going to sleep in the garage",9,"no they not go to sleep in the garage","co pro:sub neg part prep n prep det:art n","CLI",NA,"Clinician",6555,140.002874802357,"Sarah","female","declarative",NA,NA,NA,4,"Clinical-MOR",11,"eng","Bliss"
"233",4212952,6556,184,11098,91,"don't you think we should put them in here",9,"do you think we should put them in here","mod pro:per v pro:sub mod v pro:obj prep adv","CLI",NA,"Clinician",6555,140.002874802357,"Sarah","female","question",NA,NA,NA,4,"Clinical-MOR",11,"eng","Bliss"
"234",4213053,6556,186,11098,91,"well what do you think do you think we need this",11,"do you think we need this","mod pro:per v pro:sub v pro:dem","CLI",NA,"Clinician",6555,140.002874802357,"Sarah","female","question",NA,NA,NA,4,"Clinical-MOR",6,"eng","Bliss"
"235",4213105,6556,188,11098,91,"well should we put it in the garage",8,"well should we put it in the garage","co mod pro:sub v pro:per prep det:art n","CLI",NA,"Clinician",6555,140.002874802357,"Sarah","female","question",NA,NA,NA,4,"Clinical-MOR",9,"eng","Bliss"
"236",4213174,6556,190,11098,91,"shall I put it in the kitchen",7,"shall I put it in the kitchen","mod pro:sub v pro:per prep det:art n","CLI",NA,"Clinician",6555,140.002874802357,"Sarah","female","question",NA,NA,NA,4,"Clinical-MOR",8,"eng","Bliss"
"237",4213267,6556,192,11098,91,"in the bed",3,"in the bed","prep det:art n","CLI",NA,"Clinician",6555,140.002874802357,"Sarah","female","question",NA,NA,NA,4,"Clinical-MOR",3,"eng","Bliss"
"238",4213294,6556,194,11098,91,"this is the bed",4,"this be the bed","pro:dem cop det:art n","CLI",NA,"Clinician",6555,140.002874802357,"Sarah","female","declarative",NA,NA,NA,4,"Clinical-MOR",5,"eng","Bliss"
"239",4213316,6556,195,11098,91,"where are you going to put the bed",8,"where be you go to put the bed","adv:int aux pro:per part inf v det:art n","CLI",NA,"Clinician",6555,140.002874802357,"Sarah","female","question",NA,NA,NA,4,"Clinical-MOR",11,"eng","Bliss"
"240",4213372,6556,197,11098,91,"no you don't put it in the front door",9,"no you do put it in the front door","co pro:per mod v pro:per prep det:art n n","CLI",NA,"Clinician",6555,140.002874802357,"Sarah","female","declarative",NA,NA,NA,4,"Clinical-MOR",11,"eng","Bliss"
"241",4213403,6556,198,11098,91,"you put it in the bed+room don't you",8,"you put it in the do you","pro:per v pro:per prep det:art mod pro:per","CLI",NA,"Clinician",6555,140.002874802357,"Sarah","female","question",NA,NA,NA,4,"Clinical-MOR",9,"eng","Bliss"
"242",4213441,6556,200,11098,91,"do you think those people are going to be able to fit in that bed",15,"do you think those person be go to be able to fit in that bed","mod pro:per v pro:dem n aux part inf cop adj inf v prep pro:dem n","CLI",NA,"Clinician",6555,140.002874802357,"Sarah","female","question",NA,NA,NA,4,"Clinical-MOR",19,"eng","Bliss"
"243",4213518,6556,202,11098,91,"what did you say",4,"what do you say","pro:int mod pro:per v","CLI",NA,"Clinician",6555,140.002874802357,"Sarah","female","question",NA,NA,NA,4,"Clinical-MOR",5,"eng","Bliss"
"244",4213592,6556,204,11098,91,"okay well I don't know how many more beds I have let me see",14,"okay well I do know how many more bed I have let me see","co n pro:sub mod v adv:int qn qn n pro:sub v v pro:obj v","CLI",NA,"Clinician",6555,140.002874802357,"Sarah","female","declarative",NA,NA,NA,4,"Clinical-MOR",17,"eng","Bliss"
"245",4213636,6556,205,11098,91,"oh",1,"oh","co","CLI",NA,"Clinician",6555,140.002874802357,"Sarah","female","imperative_emphatic",NA,NA,NA,4,"Clinical-MOR",1,"eng","Bliss"
"246",4213647,6556,206,11098,91,"look at this one",4,"look at this one","cop prep pro:dem pro:indef","CLI",NA,"Clinician",6555,140.002874802357,"Sarah","female","imperative_emphatic",NA,NA,NA,4,"Clinical-MOR",4,"eng","Bliss"
"247",4213671,6556,208,11098,91,"what's so different about this one",6,"what so different about this one","pro:int adv adj prep pro:dem pro:indef","CLI",NA,"Clinician",6555,140.002874802357,"Sarah","female","question",NA,NA,NA,4,"Clinical-MOR",7,"eng","Bliss"
"248",4213732,6556,211,11098,91,"maybe we can fit three do you think so",9,"maybe we can fit three do you think so","adv pro:sub mod v det:num v pro:per v co","CLI",NA,"Clinician",6555,140.002874802357,"Sarah","female","question",NA,NA,NA,4,"Clinical-MOR",10,"eng","Bliss"
"249",4213785,6556,213,11098,91,"no",1,"no","co","CLI",NA,"Clinician",6555,140.002874802357,"Sarah","female","question",NA,NA,NA,4,"Clinical-MOR",1,"eng","Bliss"
"250",4213803,6556,215,11098,91,"I think we have a problem here",7,"I think we have a problem here","pro:sub v pro:sub v det:art n adv","CLI",NA,"Clinician",6555,140.002874802357,"Sarah","female","declarative",NA,NA,NA,4,"Clinical-MOR",7,"eng","Bliss"
"251",4213827,6556,216,11098,91,"you are all under arrest come out with your hands up",11,"you be all under arrest come out with your hand up","pro:per cop adv adv n v adv prep det:poss n adv","CLI",NA,"Clinician",6555,140.002874802357,"Sarah","female","imperative_emphatic",NA,NA,NA,4,"Clinical-MOR",13,"eng","Bliss"
"252",4213883,6556,218,11098,91,"I said you are",4,"I say you be","pro:sub v pro:per cop","CLI",NA,"Clinician",6555,140.002874802357,"Sarah","female","imperative_emphatic",NA,NA,NA,4,"Clinical-MOR",6,"eng","Bliss"
"253",4213902,6556,219,11098,91,"I will give you two seconds to come out_of the house",11,"I will give you two second to come out_of the house","pro:sub mod v pro:per det:num n inf v prep det:art n","CLI",NA,"Clinician",6555,140.002874802357,"Sarah","female","declarative",NA,NA,NA,4,"Clinical-MOR",12,"eng","Bliss"
"254",4213953,6556,220,11098,91,"if you don't I will come in and get you",10,"if you do I will come in and get you","conj pro:per mod pro:sub mod v adv coord v pro:per","CLI",NA,"Clinician",6555,140.002874802357,"Sarah","female","imperative_emphatic",NA,NA,NA,4,"Clinical-MOR",11,"eng","Bliss"
"255",4213989,6556,221,11098,91,"one",1,"one","pro:indef","CLI",NA,"Clinician",6555,140.002874802357,"Sarah","female","trail off",NA,NA,NA,4,"Clinical-MOR",1,"eng","Bliss"
"256",4214005,6556,223,11098,91,"good thing you people came out_of the house",8,"good thing you person come out_of the house","adj n pro:per n v prep det:art n","CLI",NA,"Clinician",6555,140.002874802357,"Sarah","female","declarative",NA,NA,NA,4,"Clinical-MOR",10,"eng","Bliss"
"257",4214049,6556,225,11098,91,"because you're disturbing the neighbors",5,"because you disturb the neighbor","conj pro:per part det:art n","CLI",NA,"Clinician",6555,140.002874802357,"Sarah","female","imperative_emphatic",NA,NA,NA,4,"Clinical-MOR",8,"eng","Bliss"
"258",4214069,6556,226,11098,91,"what do you think about that",6,"what do you think about that","pro:int mod pro:per v prep pro:dem","CLI",NA,"Clinician",6555,140.002874802357,"Sarah","female","question",NA,NA,NA,4,"Clinical-MOR",6,"eng","Bliss"
"259",4214100,6556,227,11098,91,"I'm taking you_all down to the police headquarters",8,"I take you_all down to the police headquarter","pro:sub part pro:per adv prep det:art n v","CLI",NA,"Clinician",6555,140.002874802357,"Sarah","female","declarative",NA,NA,NA,4,"Clinical-MOR",11,"eng","Bliss"
"260",4214144,6556,229,11098,91,"what are you doing",4,"what be you do","pro:int aux pro:per part","CLI",NA,"Clinician",6555,140.002874802357,"Sarah","female","question",NA,NA,NA,4,"Clinical-MOR",6,"eng","Bliss"
"261",4214215,6556,231,11098,91,"you can't put the police car in with the ambulance",10,"you can put the police car in with the ambulance","pro:per mod v det:art n n adv prep det:art n","CLI",NA,"Clinician",6555,140.002874802357,"Sarah","female","imperative_emphatic",NA,NA,NA,4,"Clinical-MOR",12,"eng","Bliss"
"262",4214247,6556,232,11098,91,"first of all it won't fit and second you can't kidnap my policeman",13,"first of all it will fit and second you can kidnap my","adv prep pro:indef pro:per mod v coord adj pro:per mod v det:poss","CLI",NA,"Clinician",6555,140.002874802357,"Sarah","female","declarative",NA,NA,NA,4,"Clinical-MOR",15,"eng","Bliss"
"263",4214295,6556,233,11098,91,"okay I think I need another policeman then",8,"okay I think I need another then","adj pro:sub v pro:sub v qn adv:tem","CLI",NA,"Clinician",6555,140.002874802357,"Sarah","female","declarative",NA,NA,NA,4,"Clinical-MOR",7,"eng","Bliss"
"264",4214324,6556,234,11098,91,"I'm going to get you_all",5,"I go to get you_all","pro:sub part inf v pro:per","CLI",NA,"Clinician",6555,140.002874802357,"Sarah","female","imperative_emphatic",NA,NA,NA,4,"Clinical-MOR",7,"eng","Bliss"
"265",4214352,6556,236,11098,91,"what do you mean no",5,"what do you mean no","pro:int mod pro:per v co","CLI",NA,"Clinician",6555,140.002874802357,"Sarah","female","imperative_emphatic",NA,NA,NA,4,"Clinical-MOR",5,"eng","Bliss"
"266",4214372,6556,237,11098,91,"give me those back bring those here",7,"give me those back bring those here","v pro:obj det:dem adj v pro:dem adv","CLI",NA,"Clinician",6555,140.002874802357,"Sarah","female","imperative_emphatic",NA,NA,NA,4,"Clinical-MOR",7,"eng","Bliss"
"267",4214393,6556,238,11098,91,"we can't play if you don't bring them back",9,"we can play if you do bring them back","pro:sub mod v conj pro:per mod v pro:obj adv","CLI",NA,"Clinician",6555,140.002874802357,"Sarah","female","imperative_emphatic",NA,NA,NA,4,"Clinical-MOR",11,"eng","Bliss"
"268",4214436,6556,240,11098,91,"I want the policeman",4,"I want the","pro:sub v det:art","CLI",NA,"Clinician",6555,140.002874802357,"Sarah","female","imperative_emphatic",NA,NA,NA,4,"Clinical-MOR",3,"eng","Bliss"
"269",4214456,6556,241,11098,91,"give it to me",4,"give it to me","v pro:per prep pro:obj","CLI",NA,"Clinician",6555,140.002874802357,"Sarah","female","declarative",NA,NA,NA,4,"Clinical-MOR",4,"eng","Bliss"
"270",4214473,6556,242,11098,91,"okay let's round them all up",6,"okay let round them all up","co v v pro:obj post adv","CLI",NA,"Clinician",6555,140.002874802357,"Sarah","female","declarative",NA,NA,NA,4,"Clinical-MOR",7,"eng","Bliss"
"271",4214495,6556,243,11098,91,"everybody in the bus",4,"everybody in the bus","pro:indef prep det:art n","CLI",NA,"Clinician",6555,140.002874802357,"Sarah","female","declarative",NA,NA,NA,4,"Clinical-MOR",4,"eng","Bliss"
"272",4214529,6556,245,11098,91,"because I'm taking you_all down to the police station",9,"because I take you_all down to the police station","conj pro:sub part pro:per adv prep det:art n n","CLI",NA,"Clinician",6555,140.002874802357,"Sarah","female","declarative",NA,NA,NA,4,"Clinical-MOR",11,"eng","Bliss"
"273",4214557,6556,246,11098,91,"you're all being arrested because you're all too silly",9,"you all be arrest because you all too silly","pro:per adv part part conj pro:per adv adv adj","CLI",NA,"Clinician",6555,140.002874802357,"Sarah","female","imperative_emphatic",NA,NA,NA,4,"Clinical-MOR",13,"eng","Bliss"
"274",4214608,6556,249,11098,91,"okay follow me",3,"okay follow me","co v pro:obj","CLI",NA,"Clinician",6555,140.002874802357,"Sarah","female","declarative",NA,NA,NA,4,"Clinical-MOR",3,"eng","Bliss"
"275",4214627,6556,251,11098,91,"what did you do",4,"what do you do","pro:int mod pro:per v","CLI",NA,"Clinician",6555,140.002874802357,"Sarah","female","question",NA,NA,NA,4,"Clinical-MOR",5,"eng","Bliss"
"276",4214685,6556,253,11098,91,"where are they going to go",6,"where be they go to go","adv:int cop pro:sub part inf v","CLI",NA,"Clinician",6555,140.002874802357,"Sarah","female","question",NA,NA,NA,4,"Clinical-MOR",8,"eng","Bliss"
"277",4214711,6556,254,11098,91,"I didn't understand you please slow down",7,"I do understand you please slow down","pro:sub mod v pro:per co adv adv","CLI",NA,"Clinician",6555,140.002874802357,"Sarah","female","declarative",NA,NA,NA,4,"Clinical-MOR",9,"eng","Bliss"
"278",4214761,6556,256,11098,91,"okay we're going to take them to court",8,"okay we go to take them to court","co pro:sub part inf v pro:obj prep n","CLI",NA,"Clinician",6555,140.002874802357,"Sarah","female","declarative",NA,NA,NA,4,"Clinical-MOR",10,"eng","Bliss"
"279",4214782,6556,257,11098,91,"line them up",3,"line them up","v pro:obj adv","CLI",NA,"Clinician",6555,140.002874802357,"Sarah","female","imperative_emphatic",NA,NA,NA,4,"Clinical-MOR",3,"eng","Bliss"
"280",4214830,6556,259,11098,91,"how did you get from the police station back to the house",12,"how do you get from the police station back to the house","adv:int mod pro:per v prep det:art n n adv prep det:art n","CLI",NA,"Clinician",6555,140.002874802357,"Sarah","female","question",NA,NA,NA,4,"Clinical-MOR",13,"eng","Bliss"
"281",4214881,6556,261,11098,91,"Sarah I didn't understand a word you said",8,"Sarah I do understand a word you say","n:prop pro:sub mod v det:art n pro:per v","CLI",NA,"Clinician",6555,140.002874802357,"Sarah","female","declarative",NA,NA,NA,4,"Clinical-MOR",11,"eng","Bliss"
"282",4214909,6556,262,11098,91,"you talked too fast",4,"you talk too fast","pro:per v adv n","CLI",NA,"Clinician",6555,140.002874802357,"Sarah","female","declarative",NA,NA,NA,4,"Clinical-MOR",5,"eng","Bliss"
"283",4214957,6556,265,11098,91,"well I think if we're going to eat dinner I think we're going to need this",16,"well I think if we go to eat dinner I think we go to need this","n pro:sub v conj pro:sub part inf v n pro:sub v pro:sub part inf v pro:dem","CLI",NA,"Clinician",6555,140.002874802357,"Sarah","female","declarative",NA,NA,NA,4,"Clinical-MOR",20,"eng","Bliss"
"284",4215035,6556,268,11098,91,"are you going to put it in the bed+room",9,"be you go to put it in the","cop pro:per part inf v pro:per prep det:art","CLI",NA,"Clinician",6555,140.002874802357,"Sarah","female","question",NA,NA,NA,4,"Clinical-MOR",11,"eng","Bliss"
"285",4215087,6556,270,11098,91,"what color do you want",5,"what color do you want","pro:int n v pro:per v","CLI",NA,"Clinician",6555,140.002874802357,"Sarah","female","question",NA,NA,NA,4,"Clinical-MOR",5,"eng","Bliss"
"286",4215117,6556,272,11098,91,"don't grab",2,"do grab","mod v","CLI",NA,"Clinician",6555,140.002874802357,"Sarah","female","declarative",NA,NA,NA,4,"Clinical-MOR",3,"eng","Bliss"
"287",4215153,6556,274,11098,91,"I don't know if we have any food",8,"I do know if we have any food","pro:sub mod v conj pro:sub v qn n","CLI",NA,"Clinician",6555,140.002874802357,"Sarah","female","declarative",NA,NA,NA,4,"Clinical-MOR",9,"eng","Bliss"
"288",4215176,6556,275,11098,91,"we may have_to make believe",5,"we may have_to make believe","pro:sub mod mod:aux v v","CLI",NA,"Clinician",6555,140.002874802357,"Sarah","female","declarative",NA,NA,NA,4,"Clinical-MOR",5,"eng","Bliss"
"289",4215210,6556,277,11098,91,"you need chairs",3,"you need chair","pro:per v n","CLI",NA,"Clinician",6555,140.002874802357,"Sarah","female","question",NA,NA,NA,4,"Clinical-MOR",4,"eng","Bliss"
"290",4215232,6556,279,11098,91,"okay here's one",3,"okay here one","co pro:exist pro:indef","CLI",NA,"Clinician",6555,140.002874802357,"Sarah","female","declarative",NA,NA,NA,4,"Clinical-MOR",4,"eng","Bliss"
"291",4215266,6556,281,11098,91,"okay",1,"okay","co","CLI",NA,"Clinician",6555,140.002874802357,"Sarah","female","declarative",NA,NA,NA,4,"Clinical-MOR",1,"eng","Bliss"
"292",4215291,6556,283,11098,91,"are they going to have breakfast or dinner",8,"be they go to have breakfast or dinner","cop pro:sub part inf v n coord n","CLI",NA,"Clinician",6555,140.002874802357,"Sarah","female","question",NA,NA,NA,4,"Clinical-MOR",10,"eng","Bliss"
"293",4215327,6556,285,11098,91,"are they going to have spaghetti then",7,"be they go to have spaghetti then","cop pro:sub part inf v n adv:tem","CLI",NA,"Clinician",6555,140.002874802357,"Sarah","female","question",NA,NA,NA,4,"Clinical-MOR",9,"eng","Bliss"
"294",4215360,6556,287,11098,91,"yuck",1,"yuck","co","CLI",NA,"Clinician",6555,140.002874802357,"Sarah","female","declarative",NA,NA,NA,4,"Clinical-MOR",1,"eng","Bliss"
"295",4215373,6556,288,11098,91,"spaghetti for breakfast",3,"spaghetti for breakfast","n prep n","CLI",NA,"Clinician",6555,140.002874802357,"Sarah","female","question",NA,NA,NA,4,"Clinical-MOR",3,"eng","Bliss"
"296",4215400,6556,290,11098,91,"what for",2,"what for","pro:int prep","CLI",NA,"Clinician",6555,140.002874802357,"Sarah","female","question",NA,NA,NA,4,"Clinical-MOR",2,"eng","Bliss"
"297",4215451,6556,292,11098,91,"and for what",3,"and for what","coord prep pro:int","CLI",NA,"Clinician",6555,140.002874802357,"Sarah","female","question",NA,NA,NA,4,"Clinical-MOR",3,"eng","Bliss"
"298",4215468,6556,293,11098,91,"you said the policeman",4,"you say the","pro:per v det:art","CLI",NA,"Clinician",6555,140.002874802357,"Sarah","female","trail off",NA,NA,NA,4,"Clinical-MOR",4,"eng","Bliss"
"299",4215500,6556,295,11098,91,"this isn't a man",4,"this be a man","pro:dem cop det:art n","CLI",NA,"Clinician",6555,140.002874802357,"Sarah","female","declarative",NA,NA,NA,4,"Clinical-MOR",6,"eng","Bliss"
"300",4215530,6556,296,11098,91,"who is it",3,"who be it","pro:int cop pro:per","CLI",NA,"Clinician",6555,140.002874802357,"Sarah","female","question",NA,NA,NA,4,"Clinical-MOR",4,"eng","Bliss"
"301",4215551,6556,298,11098,91,"it's a little baby",4,"it a little baby","pro:per det:art adj n","CLI",NA,"Clinician",6555,140.002874802357,"Sarah","female","declarative",NA,NA,NA,4,"Clinical-MOR",5,"eng","Bliss"
"302",4215583,6556,300,11098,91,"there you go",3,"there you go","adv pro:per v","CLI",NA,"Clinician",6555,140.002874802357,"Sarah","female","declarative",NA,NA,NA,4,"Clinical-MOR",3,"eng","Bliss"
"303",4215616,6556,302,11098,91,"I don't know if I have a high chair in here",11,"I do know if I have a high chair in here","pro:sub mod v conj pro:sub v det:art n n prep adv","CLI",NA,"Clinician",6555,140.002874802357,"Sarah","female","declarative",NA,NA,NA,4,"Clinical-MOR",12,"eng","Bliss"
"304",4215648,6556,303,11098,91,"no I don't have a high chair",7,"no I do have a high chair","co pro:sub mod v det:art n n","CLI",NA,"Clinician",6555,140.002874802357,"Sarah","female","declarative",NA,NA,NA,4,"Clinical-MOR",8,"eng","Bliss"
"305",4215682,6556,304,11098,91,"I think we're just going to have_to have the baby sit hm what can we do",16,"I think we just go to have_to have the baby sit hm what can we do","pro:sub v pro:sub adv part inf mod:aux v det:art n v co pro:int mod pro:sub v","CLI",NA,"Clinician",6555,140.002874802357,"Sarah","female","question",NA,NA,NA,4,"Clinical-MOR",18,"eng","Bliss"
"306",4215755,6556,306,11098,91,"well if I don't have a chair what are we going to do",13,"well if I do have a chair what be we go to do","n conj pro:sub mod v det:art n det:int aux pro:sub part inf v","CLI",NA,"Clinician",6555,140.002874802357,"Sarah","female","question",NA,NA,NA,4,"Clinical-MOR",16,"eng","Bliss"
"307",4215806,6556,307,11098,91,"as a matter of fact I don't have a chair",10,"as a matter of fact I do have a chair","prep det:art n prep n pro:sub mod v det:art n","CLI",NA,"Clinician",6555,140.002874802357,"Sarah","female","declarative",NA,NA,NA,4,"Clinical-MOR",11,"eng","Bliss"
"308",4215866,6556,309,11098,91,"no I don't that's a table",6,"no I do that a table","co pro:sub mod pro:dem det:art n","CLI",NA,"Clinician",6555,140.002874802357,"Sarah","female","declarative",NA,NA,NA,4,"Clinical-MOR",8,"eng","Bliss"
"309",4215907,6556,311,11098,91,"what can we do up here",6,"what can we do up here","pro:int mod pro:sub v adv adv","CLI",NA,"Clinician",6555,140.002874802357,"Sarah","female","question",NA,NA,NA,4,"Clinical-MOR",6,"eng","Bliss"
"310",4215954,6556,313,11098,91,"on the table",3,"on the table","prep det:art n","CLI",NA,"Clinician",6555,140.002874802357,"Sarah","female","question",NA,NA,NA,4,"Clinical-MOR",3,"eng","Bliss"
"311",4215972,6556,314,11098,91,"do we have anymore room",5,"do we have anymore room","mod pro:sub aux adv n","CLI",NA,"Clinician",6555,140.002874802357,"Sarah","female","question",NA,NA,NA,4,"Clinical-MOR",5,"eng","Bliss"
"312",4216050,6556,317,11098,91,"I don't understand what you're saying you have_to talk louder",10,"I do understand what you say you have_to talk loud","pro:sub mod v pro:int pro:per part pro:per mod:aux v adj","CLI",NA,"Clinician",6555,140.002874802357,"Sarah","female","declarative",NA,NA,NA,4,"Clinical-MOR",14,"eng","Bliss"
