"","id","speaker_id","utterance_order","transcript_id","corpus_id","gloss","num_tokens","stem","part_of_speech","speaker_code","speaker_name","speaker_role","target_child_id","target_child_age","target_child_name","target_child_sex","type","media_end","media_start","media_unit","collection_id","collection_name","num_morphemes","language","corpus_name"
"99",1835827,3281,104,5360,48,"so um we'd love to see how they're doing in middle school",12,"so we love to see how they do in middle school","adv pro:sub v inf v adv:int pro:sub part prep n n","INV",NA,"Investigator",3276,140.36427852728,NA,"female","declarative",NA,NA,NA,3,"Eng-NA",14,"eng","HSLLD"
"100",1835854,3278,105,5360,48,"mhm",1,"yes","co","MOT",NA,"Mother",3276,140.36427852728,NA,"female","declarative",NA,NA,NA,3,"Eng-NA",1,"eng","HSLLD"
"101",1835860,3278,106,5360,48,"mhm",1,"yes","co","MOT",NA,"Mother",3276,140.36427852728,NA,"female","declarative",NA,NA,NA,3,"Eng-NA",1,"eng","HSLLD"
"102",1835864,3281,107,5360,48,"www",1,"","","INV",NA,"Investigator",3276,140.36427852728,NA,"female","declarative",NA,NA,NA,3,"Eng-NA",NA,"eng","HSLLD"
"103",1835872,3278,108,5360,48,"www",1,"","","MOT",NA,"Mother",3276,140.36427852728,NA,"female","declarative",NA,NA,NA,3,"Eng-NA",NA,"eng","HSLLD"
"104",1835886,3281,110,5360,48,"all set",2,"all set","qn n","INV",NA,"Investigator",3276,140.36427852728,NA,"female","question",NA,NA,NA,3,"Eng-NA",2,"eng","HSLLD"
"105",1835905,3281,111,5360,48,"wow",1,"wow","co","INV",NA,"Investigator",3276,140.36427852728,NA,"female","imperative_emphatic",NA,NA,NA,3,"Eng-NA",1,"eng","HSLLD"
"106",1835908,3281,112,5360,48,"gosh that was quick Chi",5,"gosh that be quick Chi","co pro:rel aux adv n:prop","INV",NA,"Investigator",3276,140.36427852728,NA,"female","declarative",NA,NA,NA,3,"Eng-NA",7,"eng","HSLLD"
"107",1835922,3281,113,5360,48,"can you read can you read to me what you wrote",11,"can you read to me what you write","mod pro:per v prep pro:obj pro:int pro:per v","INV",NA,"Investigator",3276,140.36427852728,NA,"female","question",NA,NA,NA,3,"Eng-NA",10,"eng","HSLLD"
"108",1835956,3281,115,5360,48,"thanks",1,"thanks","co","INV",NA,"Investigator",3276,140.36427852728,NA,"female","declarative",NA,NA,NA,3,"Eng-NA",1,"eng","HSLLD"
"109",1836165,3281,123,5360,48,"oh",1,"oh","co","INV",NA,"Investigator",3276,140.36427852728,NA,"female","declarative",NA,NA,NA,3,"Eng-NA",1,"eng","HSLLD"
"110",1836171,3281,124,5360,48,"that's terrific",2,"that terrific","pro:dem adj","INV",NA,"Investigator",3276,140.36427852728,NA,"female","declarative",NA,NA,NA,3,"Eng-NA",3,"eng","HSLLD"
"111",1836184,3281,125,5360,48,"thank you",2,"thank you","v pro:per","INV",NA,"Investigator",3276,140.36427852728,NA,"female","declarative",NA,NA,NA,3,"Eng-NA",2,"eng","HSLLD"
"112",1836193,3281,126,5360,48,"okay let's leave it there because maybe Mom will want to see it",13,"okay let leave it there because maybe Mom will want to see it","co v v pro:per adv conj adv n:prop mod v inf v pro:per","INV",NA,"Investigator",3276,140.36427852728,NA,"female","declarative",NA,NA,NA,3,"Eng-NA",14,"eng","HSLLD"
"113",3796830,5483,5,9802,83,"do you remember what happened to the boy and the girl in the story",14,"do you remember what happen to the boy and the girl in the story","mod pro:per v pro:int v prep det:art n coord det:art n prep det:art n","INV",NA,"Investigator",5482,140.002874802357,NA,"female","question",NA,NA,NA,4,"Clinical-MOR",15,"eng","Gillam"
"114",3796887,5483,9,9802,83,"remember the best that you can",6,"remember the good that you can","v det:art adj pro:rel pro:per mod","INV",NA,"Investigator",5482,140.002874802357,NA,"female","declarative",NA,NA,NA,4,"Clinical-MOR",7,"eng","Gillam"
"115",3797468,5483,45,9802,83,"can you think of anything else to put in your story",11,"can you think of anything else to put in your story","mod pro:per v prep pro:indef post inf v prep det:poss n","INV",NA,"Investigator",5482,140.002874802357,NA,"female","question",NA,NA,NA,4,"Clinical-MOR",12,"eng","Gillam"
"116",4208245,6556,1,11098,91,"can you open this for me",6,"can you open this for me","mod pro:per v pro:dem prep pro:obj","CLI",NA,"Clinician",6555,140.002874802357,"Sarah","female","question",NA,NA,NA,4,"Clinical-MOR",6,"eng","Bliss"
"117",4208286,6556,3,11098,91,"uhhuh",1,"uhhuh","co","CLI",NA,"Clinician",6555,140.002874802357,"Sarah","female","declarative",NA,NA,NA,4,"Clinical-MOR",1,"eng","Bliss"
"118",4208293,6556,4,11098,91,"you can take him out",5,"you can take him out","pro:per mod v pro:obj adv","CLI",NA,"Clinician",6555,140.002874802357,"Sarah","female","declarative",NA,NA,NA,4,"Clinical-MOR",5,"eng","Bliss"
"119",4208307,6556,5,11098,91,"do you have one at home",6,"do you have one at home","mod pro:per v pro:indef prep n","CLI",NA,"Clinician",6555,140.002874802357,"Sarah","female","question",NA,NA,NA,4,"Clinical-MOR",6,"eng","Bliss"
"120",4208339,6556,7,11098,91,"me neither",2,"me neither","pro:obj adv","CLI",NA,"Clinician",6555,140.002874802357,"Sarah","female","declarative",NA,NA,NA,4,"Clinical-MOR",2,"eng","Bliss"
"121",4208348,6556,8,11098,91,"what do you think shall we think of a name for him",12,"shall we think of a name for him","mod pro:sub v prep det:art n prep pro:obj","CLI",NA,"Clinician",6555,140.002874802357,"Sarah","female","question",NA,NA,NA,4,"Clinical-MOR",8,"eng","Bliss"
"122",4208392,6556,9,11098,91,"or is it a her",5,"or be it a her","coord aux pro:per det:art meta","CLI",NA,"Clinician",6555,140.002874802357,"Sarah","female","question",NA,NA,NA,4,"Clinical-MOR",6,"eng","Bliss"
"123",4208416,6556,11,11098,91,"Strawberry_Shortcake",1,"Strawberry_Shortcake","n:prop","CLI",NA,"Clinician",6555,140.002874802357,"Sarah","female","question",NA,NA,NA,4,"Clinical-MOR",1,"eng","Bliss"
"124",4208422,6556,12,11098,91,"that's an awfully nice name",5,"that a awful nice name","pro:dem det:art adv adj n","CLI",NA,"Clinician",6555,140.002874802357,"Sarah","female","declarative",NA,NA,NA,4,"Clinical-MOR",8,"eng","Bliss"
"125",4208441,6556,13,11098,91,"hi Strawberry_Shortcake",2,"hi Strawberry_Shortcake","co n:prop","CLI",NA,"Clinician",6555,140.002874802357,"Sarah","female","imperative_emphatic",NA,NA,NA,4,"Clinical-MOR",2,"eng","Bliss"
"126",4208453,6556,14,11098,91,"how are you today",4,"how be you today","adv:int aux pro:per adv:tem","CLI",NA,"Clinician",6555,140.002874802357,"Sarah","female","question",NA,NA,NA,4,"Clinical-MOR",5,"eng","Bliss"
"127",4208518,6556,18,11098,91,"well I don't know if I want to show you that right away",13,"well I do know if I want to show you that right away","co pro:sub mod v conj pro:sub v inf v pro:per pro:dem adv adv","CLI",NA,"Clinician",6555,140.002874802357,"Sarah","female","declarative",NA,NA,NA,4,"Clinical-MOR",14,"eng","Bliss"
"128",4208555,6556,19,11098,91,"I have all kinds of neat things",7,"I have all kind of neat thing","pro:sub v qn n prep adj n","CLI",NA,"Clinician",6555,140.002874802357,"Sarah","female","declarative",NA,NA,NA,4,"Clinical-MOR",9,"eng","Bliss"
"129",4208573,6556,20,11098,91,"I don't think you've ever seen my house have you",10,"I do think you ever see my house have you","pro:sub mod v pro:per adv part det:poss n v pro:per","CLI",NA,"Clinician",6555,140.002874802357,"Sarah","female","question",NA,NA,NA,4,"Clinical-MOR",13,"eng","Bliss"
"130",4208630,6556,22,11098,91,"",0,"","","CLI",NA,"Clinician",6555,140.002874802357,"Sarah","female","declarative",NA,NA,NA,4,"Clinical-MOR",NA,"eng","Bliss"
"131",4208692,6556,26,11098,91,"the bus",2,"the bus","det:art n","CLI",NA,"Clinician",6555,140.002874802357,"Sarah","female","question",NA,NA,NA,4,"Clinical-MOR",2,"eng","Bliss"
"132",4208706,6556,27,11098,91,"what do you need a bus for",7,"what do you need a bus for","pro:int mod pro:per v det:art n prep","CLI",NA,"Clinician",6555,140.002874802357,"Sarah","female","question",NA,NA,NA,4,"Clinical-MOR",7,"eng","Bliss"
"133",4208740,6556,29,11098,91,"oh okay I think I have a bus",8,"oh okay I think I have a bus","co adj pro:sub v pro:sub v det:art n","CLI",NA,"Clinician",6555,140.002874802357,"Sarah","female","declarative",NA,NA,NA,4,"Clinical-MOR",8,"eng","Bliss"
"134",4208771,6556,30,11098,91,"here",1,"here","adv","CLI",NA,"Clinician",6555,140.002874802357,"Sarah","female","declarative",NA,NA,NA,4,"Clinical-MOR",1,"eng","Bliss"
"135",4208793,6556,32,11098,91,"it should try it again",5,"it should try it again","pro:per mod v pro:per adv","CLI",NA,"Clinician",6555,140.002874802357,"Sarah","female","declarative",NA,NA,NA,4,"Clinical-MOR",5,"eng","Bliss"
"136",4208807,6556,33,11098,91,"what's the problem",3,"what the problem","pro:int det:art n","CLI",NA,"Clinician",6555,140.002874802357,"Sarah","female","question",NA,NA,NA,4,"Clinical-MOR",4,"eng","Bliss"
"137",4208836,6556,35,11098,91,"maybe I can find another one",6,"maybe I can find another one","adv pro:sub mod v qn pro:indef","CLI",NA,"Clinician",6555,140.002874802357,"Sarah","female","declarative",NA,NA,NA,4,"Clinical-MOR",6,"eng","Bliss"
"138",4208858,6556,36,11098,91,"shall I try",3,"shall I try","mod pro:sub v","CLI",NA,"Clinician",6555,140.002874802357,"Sarah","female","question",NA,NA,NA,4,"Clinical-MOR",3,"eng","Bliss"
"139",4208865,6556,37,11098,91,"",0,"","","CLI",NA,"Clinician",6555,140.002874802357,"Sarah","female","declarative",NA,NA,NA,4,"Clinical-MOR",NA,"eng","Bliss"
"140",4208922,6556,40,11098,91,"I guess it's not supposed to come out there",9,"I guess it not suppose to come out there","pro:sub v pro:per neg part inf v adv adv","CLI",NA,"Clinician",6555,140.002874802357,"Sarah","female","declarative",NA,NA,NA,4,"Clinical-MOR",11,"eng","Bliss"
"141",4208967,6556,42,11098,91,"oh",1,"oh","co","CLI",NA,"Clinician",6555,140.002874802357,"Sarah","female","imperative_emphatic",NA,NA,NA,4,"Clinical-MOR",1,"eng","Bliss"
"142",4208976,6556,43,11098,91,"you don't put a car in the house just the garage",11,"you do put a car in the house just the garage","pro:per mod v det:art n prep det:art n adv det:art n","CLI",NA,"Clinician",6555,140.002874802357,"Sarah","female","declarative",NA,NA,NA,4,"Clinical-MOR",13,"eng","Bliss"
"143",4209011,6556,44,11098,91,"do you need anything else",5,"do you need anything else","mod pro:per v pro:indef post","CLI",NA,"Clinician",6555,140.002874802357,"Sarah","female","question",NA,NA,NA,4,"Clinical-MOR",5,"eng","Bliss"
"144",4209052,6556,46,11098,91,"we need some people",4,"we need some person","pro:sub v qn n","CLI",NA,"Clinician",6555,140.002874802357,"Sarah","female","declarative",NA,NA,NA,4,"Clinical-MOR",5,"eng","Bliss"
"145",4209070,6556,47,11098,91,"are you sure",3,"be you sure","cop pro:per adj","CLI",NA,"Clinician",6555,140.002874802357,"Sarah","female","question",NA,NA,NA,4,"Clinical-MOR",4,"eng","Bliss"
"146",4209092,6556,48,11098,91,"okay let's see",3,"okay let see","co v v","CLI",NA,"Clinician",6555,140.002874802357,"Sarah","female","declarative",NA,NA,NA,4,"Clinical-MOR",4,"eng","Bliss"
"147",4209105,6556,49,11098,91,"I suppose I may be able to find some people around here somewhere",13,"I suppose I may be able to find some person around here somewhere","pro:sub v pro:sub mod cop adj inf v qn n prep adv adv","CLI",NA,"Clinician",6555,140.002874802357,"Sarah","female","declarative",NA,NA,NA,4,"Clinical-MOR",14,"eng","Bliss"
"148",4209135,6556,50,11098,91,"what kind of people",4,"what kind of person","pro:int n prep n","CLI",NA,"Clinician",6555,140.002874802357,"Sarah","female","question",NA,NA,NA,4,"Clinical-MOR",5,"eng","Bliss"
"149",4209162,6556,52,11098,91,"tell me more",3,"tell me more","v pro:obj pro:indef","CLI",NA,"Clinician",6555,140.002874802357,"Sarah","female","declarative",NA,NA,NA,4,"Clinical-MOR",3,"eng","Bliss"
"150",4209188,6556,54,11098,91,"what kind of little people",5,"what kind of little person","pro:int n prep adj n","CLI",NA,"Clinician",6555,140.002874802357,"Sarah","female","question",NA,NA,NA,4,"Clinical-MOR",6,"eng","Bliss"
"151",4209207,6556,55,11098,91,"I mean there are little people and there are little people",11,"I mean there be little person and there be little person","pro:sub v adv cop adj n coord adv cop adj n","CLI",NA,"Clinician",6555,140.002874802357,"Sarah","female","imperative_emphatic",NA,NA,NA,4,"Clinical-MOR",15,"eng","Bliss"
"152",4209262,6556,57,11098,91,"okay let me see what I can find how about this",11,"okay let me see what I can find how about this","co v pro:obj v pro:int pro:sub mod v adv:int prep pro:dem","CLI",NA,"Clinician",6555,140.002874802357,"Sarah","female","question",NA,NA,NA,4,"Clinical-MOR",12,"eng","Bliss"
"153",4209318,6556,59,11098,91,"Sarah I can't understand",4,"Sarah I can understand","n:prop pro:sub mod v","CLI",NA,"Clinician",6555,140.002874802357,"Sarah","female","declarative",NA,NA,NA,4,"Clinical-MOR",5,"eng","Bliss"
"154",4209339,6556,60,11098,91,"I think you're going to have_to talk clearer for me",10,"I think you go to have_to talk clear for me","pro:sub v pro:per part inf mod:aux v adj prep pro:obj","CLI",NA,"Clinician",6555,140.002874802357,"Sarah","female","declarative",NA,NA,NA,4,"Clinical-MOR",13,"eng","Bliss"
"155",4209419,6556,62,11098,91,"well I don't know if I have one",8,"well I do know if I have one","co pro:sub mod v conj pro:sub v pro:indef","CLI",NA,"Clinician",6555,140.002874802357,"Sarah","female","declarative",NA,NA,NA,4,"Clinical-MOR",9,"eng","Bliss"
"156",4209450,6556,63,11098,91,"let me look in here",5,"let me look in here","v pro:obj co adv adv","CLI",NA,"Clinician",6555,140.002874802357,"Sarah","female","declarative",NA,NA,NA,4,"Clinical-MOR",6,"eng","Bliss"
"157",4209478,6556,64,11098,91,"oh here's one",3,"oh here one","co pro:exist pro:indef","CLI",NA,"Clinician",6555,140.002874802357,"Sarah","female","imperative_emphatic",NA,NA,NA,4,"Clinical-MOR",4,"eng","Bliss"
"158",4209498,6556,65,11098,91,"what are going to do Sarah",6,"what be go to do Sarah","pro:int aux part inf v n:prop","CLI",NA,"Clinician",6555,140.002874802357,"Sarah","female","question",NA,NA,NA,4,"Clinical-MOR",8,"eng","Bliss"
"159",4209576,6556,68,11098,91,"okay hm well I don't know",6,"okay hm well I do know","co co n pro:sub mod v","CLI",NA,"Clinician",6555,140.002874802357,"Sarah","female","declarative",NA,NA,NA,4,"Clinical-MOR",7,"eng","Bliss"
"160",4209598,6556,69,11098,91,"the garage is full of cars that's a good start for the house",13,"the garage be full of car that a good start for the house","det:art n aux adj prep n pro:dem det:art adj v prep det:art n","CLI",NA,"Clinician",6555,140.002874802357,"Sarah","female","declarative",NA,NA,NA,4,"Clinical-MOR",16,"eng","Bliss"
"161",4209646,6556,70,11098,91,"are they going to go some place",7,"be they go to go some place","cop pro:sub part inf v qn n","CLI",NA,"Clinician",6555,140.002874802357,"Sarah","female","question",NA,NA,NA,4,"Clinical-MOR",9,"eng","Bliss"
"162",4209685,6556,71,11098,91,"or is he going to go some place",8,"or be he go to go some place","coord cop pro:sub part inf v qn n","CLI",NA,"Clinician",6555,140.002874802357,"Sarah","female","question",NA,NA,NA,4,"Clinical-MOR",10,"eng","Bliss"
"163",4209739,6556,73,11098,91,"oh",1,"oh","co","CLI",NA,"Clinician",6555,140.002874802357,"Sarah","female","declarative",NA,NA,NA,4,"Clinical-MOR",1,"eng","Bliss"
"164",4209759,6556,74,11098,91,"is anyone going to go anywhere today",7,"be anyone go to go anywhere today","aux pro:indef part inf v adv adv:tem","CLI",NA,"Clinician",6555,140.002874802357,"Sarah","female","question",NA,NA,NA,4,"Clinical-MOR",9,"eng","Bliss"
"165",4209792,6556,76,11098,91,"no",1,"no","co","CLI",NA,"Clinician",6555,140.002874802357,"Sarah","female","question",NA,NA,NA,4,"Clinical-MOR",1,"eng","Bliss"
"166",4209798,6556,77,11098,91,"boy our house is awfully bare",6,"boy our house be awful bare","co det:poss n aux adv adj","CLI",NA,"Clinician",6555,140.002874802357,"Sarah","female","declarative",NA,NA,NA,4,"Clinical-MOR",9,"eng","Bliss"
"167",4209828,6556,78,11098,91,"what do you think about that",6,"what do you think about that","pro:int mod pro:per v prep pro:dem","CLI",NA,"Clinician",6555,140.002874802357,"Sarah","female","question",NA,NA,NA,4,"Clinical-MOR",6,"eng","Bliss"
"168",4209888,6556,80,11098,91,"I don't understand you Sarah",5,"I do understand you Sarah","pro:sub mod v pro:per n:prop","CLI",NA,"Clinician",6555,140.002874802357,"Sarah","female","declarative",NA,NA,NA,4,"Clinical-MOR",6,"eng","Bliss"
"169",4209923,6556,81,11098,91,"you don't talk loud enough for me",7,"you do talk loud enough for me","pro:per mod v adj adv prep pro:obj","CLI",NA,"Clinician",6555,140.002874802357,"Sarah","female","declarative",NA,NA,NA,4,"Clinical-MOR",8,"eng","Bliss"
"170",4209966,6556,82,11098,91,"I need you to talk louder so I don't need to keep asking you",14,"I need you to talk loud so I do need to keep ask you","pro:sub v pro:per prep n adj conj pro:sub mod v inf v part pro:per","CLI",NA,"Clinician",6555,140.002874802357,"Sarah","female","quotation next line",NA,NA,NA,4,"Clinical-MOR",17,"eng","Bliss"
"171",4210035,6556,83,11098,91,"what did you say",4,"what do you say","pro:int mod pro:per v","CLI",NA,"Clinician",6555,140.002874802357,"Sarah","female","question",NA,NA,NA,4,"Clinical-MOR",5,"eng","Bliss"
"172",4210058,6556,84,11098,91,"what did you say",4,"what do you say","pro:int mod pro:per v","CLI",NA,"Clinician",6555,140.002874802357,"Sarah","female","question",NA,NA,NA,4,"Clinical-MOR",5,"eng","Bliss"
"173",4210110,6556,86,11098,91,"oh",1,"oh","co","CLI",NA,"Clinician",6555,140.002874802357,"Sarah","female","imperative_emphatic",NA,NA,NA,4,"Clinical-MOR",1,"eng","Bliss"
"174",4210146,6556,88,11098,91,"no they don't go in there",6,"no they do go in there","co pro:sub mod v prep adv","CLI",NA,"Clinician",6555,140.002874802357,"Sarah","female","declarative",NA,NA,NA,4,"Clinical-MOR",7,"eng","Bliss"
"175",4210181,6556,89,11098,91,"I'll tell you who goes in there",7,"I tell you who go in there","pro:sub v pro:per pro:rel v adv adv","CLI",NA,"Clinician",6555,140.002874802357,"Sarah","female","declarative",NA,NA,NA,4,"Clinical-MOR",9,"eng","Bliss"
"176",4210221,6556,90,11098,91,"I would say who else could I put in there",10,"who else could I put in there","pro:int post mod pro:sub v adv adv","CLI",NA,"Clinician",6555,140.002874802357,"Sarah","female","question",NA,NA,NA,4,"Clinical-MOR",8,"eng","Bliss"
"177",4210289,6556,92,11098,91,"what else could we use",5,"what else could we use","pro:int post mod pro:sub v","CLI",NA,"Clinician",6555,140.002874802357,"Sarah","female","question",NA,NA,NA,4,"Clinical-MOR",5,"eng","Bliss"
"178",4210327,6556,93,11098,91,"this is your house",4,"this be your house","pro:dem cop det:poss n","CLI",NA,"Clinician",6555,140.002874802357,"Sarah","female","declarative",NA,NA,NA,4,"Clinical-MOR",5,"eng","Bliss"
"179",4210370,6556,95,11098,91,"are you sure that's all you want",7,"be you sure that all you want","cop pro:per adj pro:dem pro:indef pro:per v","CLI",NA,"Clinician",6555,140.002874802357,"Sarah","female","question",NA,NA,NA,4,"Clinical-MOR",9,"eng","Bliss"
"180",4210415,6556,96,11098,91,"this could be a very boring house",7,"this could be a very bore house","pro:dem mod cop det:art adv part n","CLI",NA,"Clinician",6555,140.002874802357,"Sarah","female","declarative",NA,NA,NA,4,"Clinical-MOR",8,"eng","Bliss"
"181",4210450,6556,97,11098,91,"okay well what kind",4,"okay well what kind","co co pro:int n","CLI",NA,"Clinician",6555,140.002874802357,"Sarah","female","question",NA,NA,NA,4,"Clinical-MOR",4,"eng","Bliss"
"182",4210490,6556,99,11098,91,"here's one",2,"here one","pro:exist pro:indef","CLI",NA,"Clinician",6555,140.002874802357,"Sarah","female","declarative",NA,NA,NA,4,"Clinical-MOR",3,"eng","Bliss"
"183",4210555,6556,102,11098,91,"okay",1,"okay","co","CLI",NA,"Clinician",6555,140.002874802357,"Sarah","female","declarative",NA,NA,NA,4,"Clinical-MOR",1,"eng","Bliss"
"184",4210613,6556,104,11098,91,"oh you need another person to go on your bus how many can we get in there do you think",20,"oh you need another person to go on your bus how many can we get in there do you think","co pro:per v qn n inf v prep det:poss n adv:int qn mod pro:sub v adv adv v pro:per v","CLI",NA,"Clinician",6555,140.002874802357,"Sarah","female","question",NA,NA,NA,4,"Clinical-MOR",20,"eng","Bliss"
"185",4210723,6556,106,11098,91,"two",1,"two","det:num","CLI",NA,"Clinician",6555,140.002874802357,"Sarah","female","question",NA,NA,NA,4,"Clinical-MOR",1,"eng","Bliss"
"186",4210731,6556,107,11098,91,"okay well let's see",4,"okay well let see","co co v v","CLI",NA,"Clinician",6555,140.002874802357,"Sarah","female","declarative",NA,NA,NA,4,"Clinical-MOR",5,"eng","Bliss"
"187",4210784,6556,109,11098,91,"who do you think this is",6,"who do you think this be","pro:int mod pro:per v pro:dem cop","CLI",NA,"Clinician",6555,140.002874802357,"Sarah","female","question",NA,NA,NA,4,"Clinical-MOR",7,"eng","Bliss"
"188",4210817,6556,110,11098,91,"look at it before you take it",7,"look at it before you take it","cop prep pro:per adv pro:per v pro:per","CLI",NA,"Clinician",6555,140.002874802357,"Sarah","female","declarative",NA,NA,NA,4,"Clinical-MOR",7,"eng","Bliss"
"189",4210876,6556,112,11098,91,"does she look young or does she look old",9,"do she look young or do she look old","mod pro:sub cop adj coord v pro:sub cop adj","CLI",NA,"Clinician",6555,140.002874802357,"Sarah","female","question",NA,NA,NA,4,"Clinical-MOR",11,"eng","Bliss"
"190",4210922,6556,114,11098,91,"yes she does look old",5,"yes she do look old","co pro:sub v cop adj","CLI",NA,"Clinician",6555,140.002874802357,"Sarah","female","declarative",NA,NA,NA,4,"Clinical-MOR",6,"eng","Bliss"
"191",4210959,6556,115,11098,91,"that looks like grandma to me",6,"that look like ma to me","pro:dem cop conj n prep pro:obj","CLI",NA,"Clinician",6555,140.002874802357,"Sarah","female","declarative",NA,NA,NA,4,"Clinical-MOR",8,"eng","Bliss"
"192",4210985,6556,116,11098,91,"you'd better be careful with grandma in that bus",9,"you good be careful with ma in that bus","pro:per adj aux co prep n prep pro:dem n","CLI",NA,"Clinician",6555,140.002874802357,"Sarah","female","declarative",NA,NA,NA,4,"Clinical-MOR",12,"eng","Bliss"
"193",4211085,6556,119,11098,91,"how many more",3,"how many more","adv:int qn pro:indef","CLI",NA,"Clinician",6555,140.002874802357,"Sarah","female","question",NA,NA,NA,4,"Clinical-MOR",3,"eng","Bliss"
"194",4211120,6556,121,11098,91,"okay",1,"okay","co","CLI",NA,"Clinician",6555,140.002874802357,"Sarah","female","declarative",NA,NA,NA,4,"Clinical-MOR",1,"eng","Bliss"
"195",4211212,6556,124,11098,91,"you have_to talk louder for me",6,"you have_to talk loud for me","pro:per mod:aux v adj prep pro:obj","CLI",NA,"Clinician",6555,140.002874802357,"Sarah","female","declarative",NA,NA,NA,4,"Clinical-MOR",7,"eng","Bliss"
"196",4211273,6556,126,11098,91,"she fell on her head",5,"she fall on her head","pro:sub v prep det:poss n","CLI",NA,"Clinician",6555,140.002874802357,"Sarah","female","imperative_emphatic",NA,NA,NA,4,"Clinical-MOR",6,"eng","Bliss"
"197",4211303,6556,127,11098,91,"you made her drop on her head",7,"you make her drop on her head","pro:per v det:poss n prep det:poss n","CLI",NA,"Clinician",6555,140.002874802357,"Sarah","female","imperative_emphatic",NA,NA,NA,4,"Clinical-MOR",8,"eng","Bliss"
"198",4211339,6556,128,11098,91,"I think we need to get the ambulance",8,"I think we need to get the ambulance","pro:sub v pro:sub v inf v det:art n","CLI",NA,"Clinician",6555,140.002874802357,"Sarah","female","declarative",NA,NA,NA,4,"Clinical-MOR",8,"eng","Bliss"
"199",4211384,6556,129,11098,91,"what are you going to do",6,"what be you go to do","pro:int aux pro:per part inf v","CLI",NA,"Clinician",6555,140.002874802357,"Sarah","female","question",NA,NA,NA,4,"Clinical-MOR",8,"eng","Bliss"
"200",4211411,6556,130,11098,91,"she fell on her head",5,"she fall on her head","pro:sub v prep det:poss n","CLI",NA,"Clinician",6555,140.002874802357,"Sarah","female","declarative",NA,NA,NA,4,"Clinical-MOR",6,"eng","Bliss"
"201",4211440,6556,131,11098,91,"okay if you're not going to use it",8,"okay if you not go to use it","adj conj pro:per neg part inf v pro:per","CLI",NA,"Clinician",6555,140.002874802357,"Sarah","female","trail off",NA,NA,NA,4,"Clinical-MOR",10,"eng","Bliss"
"202",4211519,6556,134,11098,91,"well what for",3,"well what for","co pro:int prep","CLI",NA,"Clinician",6555,140.002874802357,"Sarah","female","question",NA,NA,NA,4,"Clinical-MOR",3,"eng","Bliss"
"203",4211619,6556,137,11098,91,"no no no you mean you need a person for this one",12,"no no no you mean you need a person for this one","co co co pro:per v pro:per v det:art n prep pro:dem pro:indef","CLI",NA,"Clinician",6555,140.002874802357,"Sarah","female","declarative",NA,NA,NA,4,"Clinical-MOR",12,"eng","Bliss"
"204",4211671,6556,138,11098,91,"okay let's see if we can find somebody to drive this ambulance",12,"okay let see if we can find somebody to drive this ambulance","co v v conj pro:sub mod v pro:indef inf v pro:dem n","CLI",NA,"Clinician",6555,140.002874802357,"Sarah","female","declarative",NA,NA,NA,4,"Clinical-MOR",13,"eng","Bliss"
"205",4211736,6556,140,11098,91,"pardon me",2,"pardon me","v pro:obj","CLI",NA,"Clinician",6555,140.002874802357,"Sarah","female","declarative",NA,NA,NA,4,"Clinical-MOR",2,"eng","Bliss"
"206",4211778,6556,142,11098,91,"this is a policeman we don't need a policeman",9,"this be a we do need a","pro:dem cop det:art pro:sub mod v det:art","CLI",NA,"Clinician",6555,140.002874802357,"Sarah","female","declarative",NA,NA,NA,4,"Clinical-MOR",9,"eng","Bliss"
"207",4211815,6556,143,11098,91,"this looks like it'll do",5,"this look like it do","pro:dem cop conj pro:per v","CLI",NA,"Clinician",6555,140.002874802357,"Sarah","female","declarative",NA,NA,NA,4,"Clinical-MOR",7,"eng","Bliss"
"208",4211867,6556,145,11098,91,"okay I'm taking this away",5,"okay I take this away","co pro:sub part pro:dem adv","CLI",NA,"Clinician",6555,140.002874802357,"Sarah","female","declarative",NA,NA,NA,4,"Clinical-MOR",7,"eng","Bliss"
